{
  "queue_entry_version": 1,
  "queue_entry_id": "queue_candidate_task",
  "task_id": "candidate-task",
  "source_task_contract": "TODO/path/to/candidate-task-contract.md",
  "source_dependency_map": "TODO",
  "queue_status": "candidate",
  "queue_reason": "created_from_candidate_task",
  "dependency_status": "not_checked",
  "lint_status": "not_run",
  "context_status": "not_checked",
  "ui_contract_status": "not_checked",
  "approval_status": "not_checked",
  "owner_review_status": "not_checked",
  "depends_on": [],
  "blocked_by": [],
  "priority": "normal",
  "risk_level": "LOW",
  "human_approval_required": false,
  "owner_review_required": false,
  "created_at": "2026-05-15T09:30:00Z",
  "non_approval_warning": "Queue entry is not approval and does not authorize execution."
}
