{
  "queue_entry_version": 1,
  "queue_entry_id": "queue_blocked_dependency_task",
  "task_id": "blocked-dependency-task",
  "source_task_contract": "TODO/path/to/blocked-dependency-task-contract.md",
  "source_dependency_map": "TODO",
  "queue_status": "blocked",
  "queue_reason": "blocked_by_dependency",
  "dependency_status": "blocked",
  "lint_status": "not_run",
  "context_status": "not_checked",
  "ui_contract_status": "not_checked",
  "approval_status": "required_missing",
  "owner_review_status": "not_checked",
  "depends_on": [
    "task-a"
  ],
  "blocked_by": [
    "dependency"
  ],
  "priority": "normal",
  "risk_level": "MEDIUM",
  "human_approval_required": true,
  "owner_review_required": false,
  "created_at": "2026-05-15T09:31:00Z",
  "non_approval_warning": "Queue entry is not approval and does not authorize execution."
}
